{
    "host": {
        "hostname": "0.0.0.0",
        "port": 9002,
        "instancesServerPort": 9003,
        "id": "STH-0"
    },
    "description": "lorem lorem ipsum",
    "tags": [
        "lorem",
        "ipsum"
    ],
    "timings": {
        "instanceLifetimeExtensionDelay": 10000
    },
    "platform": {
        "apiKey": "4tvMSwTJu6D4bF65SK8mKZ3NP1F9CMB7Gbv2EK33b9hBkpB9qBoPfOwukxGhkCnLmoCRody0x28UcwVnwTm+Q95uMb7fnIT3R6Nez9f4kkmyB0k5",
        "api": "http://0.0.0.0:7000",
        "space": "org-f6404a68-959f-46e8-8324-cfbb30692d99:org-f6404a68-959f-46e8-8324-cfbb30692d99-manager"
    }
}
